containers/matrix.json

[
    {
        "name": "ubuntu-24.04-multi",
        "aliases": [
            "ubuntu-24.04-multi",
            "ubuntu",
            "ubuntu-24.04",
            "ubuntu-devel",
            "devel",
            "multi"
        ],
        "dir": "ubuntu/multi",
        "args": [
            "DISTRO=ubuntu",
            "RELEASE=24.04"
        ],
        "tags": [
            "ghcr.io/r-lib/rig/r:latest",
            "ghcr.io/r-lib/rig/rig:latest",
            "ghcr.io/r-lib/rig/multi:latest",
            "ghcr.io/r-lib/rig/ubuntu-24.04-multi:latest",
            "ghcr.io/r-lib/rig/ubuntu-multi:latest"
        ]
    },
    {
        "name": "ubuntu-26.04-release",
        "aliases": [
            "ubuntu-26.04-release",
            "ubuntu",
            "ubuntu-26.04",
            "ubuntu-release",
            "release"
        ],
        "dir": "ubuntu",
        "args": [
            "DISTRO=ubuntu",
            "RELEASE=26.04",
            "RVERSION=release"
        ],
        "tags": [
            "ghcr.io/r-lib/rig/ubuntu-26.04-release:latest",
            "ghcr.io/r-lib/rig/ubuntu-26.04:latest",
            "ghcr.io/r-lib/rig/ubuntu-latest-release:latest",
            "ghcr.io/r-lib/rig/ubuntu-latest:latest",
            "ghcr.io/r-lib/rig/ubuntu-release:latest",
            "ghcr.io/r-lib/rig/ubuntu:latest",
            "ghcr.io/r-lib/rig/release:latest"
        ]
    },
    {
        "name": "ubuntu-26.04-devel",
        "aliases": [
            "ubuntu-26.04-devel",
            "ubuntu",
            "ubuntu-26.04",
            "ubuntu-devel",
            "devel"
        ],
        "dir": "ubuntu",
        "args": [
            "DISTRO=ubuntu",
            "RELEASE=26.04",
            "RVERSION=devel"
        ],
        "tags": [
            "ghcr.io/r-lib/rig/ubuntu-26.04-devel:latest",
            "ghcr.io/r-lib/rig/ubuntu-latest-devel:latest",
            "ghcr.io/r-lib/rig/ubuntu-devel:latest",
            "ghcr.io/r-lib/rig/devel:latest"
        ]
    },
    {
        "name": "ubuntu-24.04-release",
        "aliases": [
            "ubuntu-24.04-release",
            "ubuntu",
            "ubuntu-24.04",
            "ubuntu-release",
            "release"
        ],
        "dir": "ubuntu",
        "args": [
            "DISTRO=ubuntu",
            "RELEASE=24.04",
            "RVERSION=release"
        ],
        "tags": [
            "ghcr.io/r-lib/rig/ubuntu-24.04-release:latest",
            "ghcr.io/r-lib/rig/ubuntu-24.04:latest"
        ]
    },
    {
        "name": "ubuntu-24.04-devel",
        "aliases": [
            "ubuntu-24.04-devel",
            "ubuntu",
            "ubuntu-24.04",
            "ubuntu-devel",
            "devel"
        ],
        "dir": "ubuntu",
        "args": [
            "DISTRO=ubuntu",
            "RELEASE=24.04",
            "RVERSION=devel"
        ],
        "tags": [
            "ghcr.io/r-lib/rig/ubuntu-24.04-devel:latest"
        ]
    },
    {
        "name": "ubuntu-22.04-release",
        "aliases": [
            "ubuntu-22.04-release",
            "ubuntu",
            "ubuntu-22.04",
            "ubuntu-release",
            "release"
        ],
        "dir": "ubuntu",
        "args": [
            "DISTRO=ubuntu",
            "RELEASE=22.04",
            "RVERSION=release"
        ],
        "tags": [
            "ghcr.io/r-lib/rig/ubuntu-22.04-release:latest",
            "ghcr.io/r-lib/rig/ubuntu-22.04:latest"
        ]
    },
    {
        "name": "ubuntu-22.04-devel",
        "aliases": [
            "ubuntu-22.04-devel",
            "ubuntu",
            "ubuntu-22.04",
            "ubuntu-devel",
            "devel"
        ],
        "dir": "ubuntu",
        "args": [
            "DISTRO=ubuntu",
            "RELEASE=22.04",
            "RVERSION=devel"
        ],
        "tags": [
            "ghcr.io/r-lib/rig/ubuntu-22.04-devel:latest"
        ]
    },
    {
        "name": "ubuntu-20.04-release",
        "aliases": [
            "ubuntu-20.04-release",
            "ubuntu",
            "ubuntu-20.04",
            "ubuntu-release",
            "release"
        ],
        "dir": "ubuntu",
        "args": [
            "DISTRO=ubuntu",
            "RELEASE=20.04",
            "RVERSION=release"
        ],
        "tags": [
            "ghcr.io/r-lib/rig/ubuntu-20.04-release:latest",
            "ghcr.io/r-lib/rig/ubuntu-20.04:latest"
        ]
    },
    {
        "name": "ubuntu-20.04-devel",
        "aliases": [
            "ubuntu-20.04-devel",
            "ubuntu",
            "ubuntu-20.04",
            "ubuntu-devel",
            "devel"
        ],
        "dir": "ubuntu",
        "args": [
            "DISTRO=ubuntu",
            "RELEASE=20.04",
            "RVERSION=devel"
        ],
        "tags": [
            "ghcr.io/r-lib/rig/ubuntu-20.04-devel:latest"
        ]
    },
    {
        "name": "debian-13-release",
        "aliases": [
            "debian-13-release",
            "debian",
            "debian-13",
            "debian-release",
            "release"
        ],
        "dir": "ubuntu",
        "args": [
            "DISTRO=debian",
            "RELEASE=13",
            "RVERSION=release"
        ],
        "tags": [
            "ghcr.io/r-lib/rig/debian-13-release:latest",
            "ghcr.io/r-lib/rig/debian-13:latest",
            "ghcr.io/r-lib/rig/debian-latest-release:latest",
            "ghcr.io/r-lib/rig/debian-latest:latest",
            "ghcr.io/r-lib/rig/debian-release:latest",
            "ghcr.io/r-lib/rig/debian:latest"
        ]
    },
    {
        "name": "debian-13-devel",
        "aliases": [
            "debian-13-devel",
            "debian",
            "debian-13",
            "debian-devel",
            "devel"
        ],
        "dir": "ubuntu",
        "args": [
            "DISTRO=debian",
            "RELEASE=13",
            "RVERSION=devel"
        ],
        "tags": [
            "ghcr.io/r-lib/rig/debian-13-devel:latest",
            "ghcr.io/r-lib/rig/debian-latest-devel:latest",
            "ghcr.io/r-lib/rig/debian-devel:latest"
        ]
    },
    {
        "name": "fedora-43-release",
        "aliases": [
            "fedora-43-release",
            "fedora",
            "fedora-43",
            "fedora-release",
            "release"
        ],
        "dir": "fedora",
        "args": [
            "RELEASE=43",
            "RVERSION=release"
        ],
        "tags": [
            "ghcr.io/r-lib/rig/fedora-43-release:latest",
            "ghcr.io/r-lib/rig/fedora-43:latest"
        ]
    },
    {
        "name": "fedora-43-devel",
        "aliases": [
            "fedora-43-devel",
            "fedora",
            "fedora-43",
            "fedora-devel",
            "devel"
        ],
        "dir": "fedora",
        "args": [
            "RELEASE=43",
            "RVERSION=devel"
        ],
        "tags": [
            "ghcr.io/r-lib/rig/fedora-43-devel:latest"
        ]
    },
    {
        "name": "fedora-44-release",
        "aliases": [
            "fedora-44-release",
            "fedora",
            "fedora-44",
            "fedora-release",
            "release"
        ],
        "dir": "fedora",
        "args": [
            "RELEASE=44",
            "RVERSION=release"
        ],
        "tags": [
            "ghcr.io/r-lib/rig/fedora-44-release:latest",
            "ghcr.io/r-lib/rig/fedora-44:latest",
            "ghcr.io/r-lib/rig/fedora-latest-release:latest",
            "ghcr.io/r-lib/rig/fedora-latest:latest",
            "ghcr.io/r-lib/rig/fedora-release:latest",
            "ghcr.io/r-lib/rig/fedora:latest"
        ]
    },
    {
        "name": "fedora-44-devel",
        "aliases": [
            "fedora-44-devel",
            "fedora",
            "fedora-44",
            "fedora-devel",
            "devel"
        ],
        "dir": "fedora",
        "args": [
            "RELEASE=44",
            "RVERSION=devel"
        ],
        "tags": [
            "ghcr.io/r-lib/rig/fedora-44-devel:latest",
            "ghcr.io/r-lib/rig/fedora-latest-devel:latest",
            "ghcr.io/r-lib/rig/fedora-devel:latest"
        ]
    },
    {
        "name": "opensuse-16.0-release",
        "aliases": [
            "opensuse-16.0-release",
            "opensuse",
            "opensuse-16.0",
            "opensuse-release",
            "release"
        ],
        "dir": "suse",
        "args": [
            "RELEASE=16.0",
            "RVERSION=release"
        ],
        "tags": [
            "ghcr.io/r-lib/rig/opensuse-16.0-release:latest",
            "ghcr.io/r-lib/rig/opensuse-16.0:latest",
            "ghcr.io/r-lib/rig/opensuse-latest-release:latest",
            "ghcr.io/r-lib/rig/opensuse-latest:latest",
            "ghcr.io/r-lib/rig/opensuse-release:latest",
            "ghcr.io/r-lib/rig/opensuse:latest"
        ]
    },
    {
        "name": "opensuse-16.0-devel",
        "aliases": [
            "opensuse-16.0-devel",
            "opensuse",
            "opensuse-16.0",
            "opensuse-devel",
            "devel"
        ],
        "dir": "suse",
        "args": [
            "RELEASE=16.0",
            "RVERSION=devel"
        ],
        "tags": [
            "ghcr.io/r-lib/rig/opensuse-16.0-devel:latest",
            "ghcr.io/r-lib/rig/opensuse-latest-devel:latest",
            "ghcr.io/r-lib/rig/opensuse-devel:latest"
        ]
    },
    {
        "name": "opensuse-15.6-release",
        "aliases": [
            "opensuse-15.6-release",
            "opensuse",
            "opensuse-15.6",
            "opensuse-release",
            "release"
        ],
        "dir": "suse",
        "args": [
            "RELEASE=15.6",
            "RVERSION=release"
        ],
        "tags": [
            "ghcr.io/r-lib/rig/opensuse-15.6-release:latest",
            "ghcr.io/r-lib/rig/opensuse-15.6:latest"
        ]
    },
    {
        "name": "opensuse-15.6-devel",
        "aliases": [
            "opensuse-15.6-devel",
            "opensuse",
            "opensuse-15.6",
            "opensuse-devel",
            "devel"
        ],
        "dir": "suse",
        "args": [
            "RELEASE=15.6",
            "RVERSION=devel"
        ],
        "tags": [
            "ghcr.io/r-lib/rig/opensuse-15.6-devel:latest"
        ]
    }
]

website/_partials/docker.md

Use the `ghcr.io/r-lib/rig/r` Docker container to easily run multiple
R versions.
It is currently based on Ubuntu 22.04 and contains rig and the six latest
R versions, including R-next and R-devel.
It is available for x86_64 and arm64 systems:

## All containers

Name                                      | OS                 | R version      | Tags
------------------------------------------|--------------------|----------------|------------------------------------------------------------------------------------------------
`ghcr.io/r-lib/rig/ubuntu-24.04-multi`    | Ubuntu 24.04       | last 6 (daily) | `r`, `rig`, `multi`, `ubuntu-multi`
`ghcr.io/r-lib/rig/ubuntu-26.04-release`  | Ubuntu 26.04       | release        | `release`, `ubuntu`, `ubuntu-release`, `ubuntu-latest`, `ubuntu-latest-release`, `ubuntu-26.04`
`ghcr.io/r-lib/rig/ubuntu-26.04-devel`    | Ubuntu 26.04       | devel (daily)  | `devel`, `ubuntu-devel`, `ubuntu-latest-devel`
`ghcr.io/r-lib/rig/ubuntu-24.04-release`  | Ubuntu 24.04       | release        | `ubuntu-24.04`
`ghcr.io/r-lib/rig/ubuntu-24.04-devel`    | Ubuntu 24.04       | devel (daily)  |
`ghcr.io/r-lib/rig/ubuntu-22.04-release`  | Ubuntu 22.04       | release        | `ubuntu-22.04`
`ghcr.io/r-lib/rig/ubuntu-22.04-devel`    | Ubuntu 22.04       | devel (daily)  |
`ghcr.io/r-lib/rig/ubuntu-20.04-release`  | Ubuntu 20.04       | release        | `ubuntu-20.04`
`ghcr.io/r-lib/rig/ubuntu-20.04-devel`    | Ubuntu 20.04       | devel (daily)  |
`ghcr.io/r-lib/rig/debian-13-release`     | Debian 13          | release        | `debian`, `debian-release`, `debian-latest`, `debian-latest-release`, `debian-13`
`ghcr.io/r-lib/rig/debian-13-devel`       | Debian 13          | devel (daily)  | `debian-devel`, `debian-latest-devel`
`ghcr.io/r-lib/rig/debian-12-release`     | Debian 12          | release        | `debian-12`
`ghcr.io/r-lib/rig/debian-12-devel`       | Debian 12          | devel (daily)  |
`ghcr.io/r-lib/rig/fedora-43-release`     | Fedora 43          | release        | `fedora`, `fedora-release`, `fedora-latest`, `fedora-latest-release`, `fedora-43`
`ghcr.io/r-lib/rig/fedora-43-devel`       | Fedora 43          | devel          | `fedora-devel`, `fedora-latest-devel`
`ghcr.io/r-lib/rig/fedora-42-release`     | Fedora 42          | release        | `fedora-42`
`ghcr.io/r-lib/rig/fedora-42-devel`       | Fedora 42          | devel          |
`ghcr.io/r-lib/rig/opensuse-16.0-release` | OpenSUSE Leap 16.0 | release        | `opensuse`, `opensuse-release`, `opensuse-latest`, `opensuse-latest-release`, `opensuse-16.0`
`ghcr.io/r-lib/rig/opensuse-16.0-devel`   | OpenSUSE Leap 16.0 | devel (daily)  | `opensuse-devel`, `opensuse-latest-devel`
`ghcr.io/r-lib/rig/opensuse-15.6-release` | OpenSUSE Leap 15.6 | release        | `opensuse-15.6`
`ghcr.io/r-lib/rig/opensuse-15.6-devel`   | OpenSUSE Leap 15.6 | devel (daily)  |

Tag                                | Current Image           | Description
-----------------------------------|-------------------------|------------------------------------
`ghcr.io/r-lib/rig/r`              | `ubuntu-24.04-multi`    | Last 6 R versions on latest Ubuntu.
`ghcr.io/r-lib/rig/rig`            | "                       | "
`ghcr.io/r-lib/rig/multi`          | "                       | "
`ghcr.io/r-lib/rig/ubuntu-multi`   | "                       | "
`ghcr.io/r-lib/rig/release`        | `ubuntu-26.04-release`  | Latest R release.
`ghcr.io/r-lib/rig/ubuntu`         | `ubuntu-26.04-release`  | Latest R release on latest Ubuntu.
`ghcr.io/r-lib/rig/ubuntu-26.04`   | `ubuntu-26.04-release`  | Latest R release on Ubuntu 26.04.
`ghcr.io/r-lib/rig/devel`          | `ubuntu-26.04-devel`    | R devel.
`ghcr.io/r-lib/rig/ubuntu-devel`   | `ubuntu-26.04-devel`    | R devel on latest Ubuntu.
`ghcr.io/r-lib/rig/ubuntu-24.04`   | `ubuntu-24.04-release`  | Latest R release on Ubuntu 24.04.
`ghcr.io/r-lib/rig/ubuntu-22.04`   | `ubuntu-22.04-release`  | Latest R release on Ubuntu 22.04.
`ghcr.io/r-lib/rig/ubuntu-20.04`   | `ubuntu-20.04-release`  | Latest R release on Ubuntu 20.04.
`ghcr.io/r-lib/rig/debian`         | `debian-13-release`     | Latest R release on latest Debian.
`ghcr.io/r-lib/rig/debian-13`      | `debian-13-release`     | Latest R release on Debian 13.
`ghcr.io/r-lib/rig/debian-12`      | `debian-12-release`     | Latest R release on Debian 12.
`ghcr.io/r-lib/rig/debian-devel`   | `debian-13-devel`       | R devel on latest Debian.
`ghcr.io/r-lib/rig/fedora`         | `fedora-43-release`     | Latest R release on latest Fedora.
`ghcr.io/r-lib/rig/fedora-43`      | `fedora-43-release`     | Latest R release on Fedora 43.
`ghcr.io/r-lib/rig/fedora-42`      | `fedora-42-release`     | Latest R release on Fedora 42.
`ghcr.io/r-lib/rig/fedora-devel`   | `fedora-43-devel`       | R devel on latest Fedora.
`ghcr.io/r-lib/rig/opensuse`       | `opensuse-16.0-release` | Latest R release on latest OpenSUSE.
`ghcr.io/r-lib/rig/opensuse-16.0`  | `opensuse-16.0-release` | Latest R release on OpenSUSE 16.0.
`ghcr.io/r-lib/rig/opensuse-15.6`  | `opensuse-15.6-release` | Latest R release on OpenSUSE 15.6.
`ghcr.io/r-lib/rig/opensuse-devel` | `opensuse-16.0-devel`   | R devel on latest OpenSUSE.